{
  "id": "sharashayyama_ladeka_bhishmapitamahale_gareko_shrikrishnastutianubad",
  "title": "शरशय्यामा लडेका भीष्मपितामहले गरेको श्रीकृष्ण-स्तुति(अनुवाद)",
  "title_roman": "Sharashayyama Ladeka Bhishmapitamahale Gareko Shrikrishnastutianubad",
  "subtitle": null,
  "author": {
    "id": "lekhnath_paudyal",
    "name": "लेखनाथ पौड्याल",
    "name_roman": "Lekhnath Paudyal"
  },
  "language": "ne",
  "script": "Devanagari",
  "genre": [
    "kavita"
  ],
  "first_published": {
    "bs": null,
    "ad": null
  },
  "edition": "पहिलो; २०७६",
  "publisher": "मञ्जरी पब्लिकेशन",
  "description": "From the collection लालित्य भाग १. Transcribed from the identified Sahitya Ras source edition. Source wording and literary structure retained; not checked against printed pages.",
  "rights": {
    "status": "public-domain",
    "basis": "Author died 1966; public domain since 2016 (Nepal's Copyright Act 2059: life + 50 years)."
  },
  "source": {
    "name": "Sahitya Ras (sahityaras.com)",
    "url": "https://sahityaras.com/book/lalitya-bhag-1/sharashayyama-ladeka-bhishmapitamahale-gareko-shrikrishna-stuti/",
    "pdf": "sahityaras-lalitya-bhag-1.pdf",
    "html": "extracted/index.html",
    "pdf_editions": [
      {
        "id": "sahityaras-lalitya-bhag-1",
        "file": "sahityaras-lalitya-bhag-1.pdf",
        "kind": "typeset",
        "label": "साहित्यरस · लालित्य भाग १",
        "sha256": "5c264ccc2e6571f462ae3df470bf1d8a3cb6ccef83ac7988d8e1e506377b1c9d",
        "page_count": 3,
        "origin": {
          "name": "Sahitya Ras",
          "url": "https://sahityaras.com/download.php?book=lalitya-bhag-1&format=pdf"
        },
        "sections": [
          {
            "label": "शरशय्यामा लडेका भिष्मपितामहले गरेको श्रीकृष्ण-स्तुति",
            "page_start": 1,
            "page_end": 3
          }
        ]
      }
    ]
  },
  "pages": 3,
  "text": {
    "extraction_method": "html",
    "ocr_status": "born-digital",
    "proofread": false,
    "quality": null
  },
  "formats": {
    "pdf": "sahityaras-lalitya-bhag-1.pdf",
    "txt": "text.txt",
    "html": "reader.html",
    "epub": "reader.epub"
  },
  "added": "2026-09-08",
  "updated": "2026-09-09",
  "summary": "शरशय्यामा रहेका भीष्मले कृष्णको स्तुति गरेको महाभारतीय प्रसङ्गलाई भक्तिपूर्ण नेपाली अनुवादमा प्रस्तुत गरिएको छ।",
  "prosody": {
    "status": "reviewed",
    "kind": "single",
    "metres": [
      "pushpitagra"
    ],
    "text_sha256": "07dcbb72381b12151dd03dea74f7c87e8f48b1dc7e4c7481d107828d3277acd9",
    "reviewed": "2026-10-31",
    "evidence": [
      {
        "basis": "metrical-reading",
        "file": "extracted/index.html",
        "sha256": "ff9210f04ed410dc41d83a2ed9bf0339014088340118d5d6dcb26e20b42e8d36",
        "locator": "शरशय्यामा लडेका भीष्मपितामहले गरेको श्रीकृष्ण-स्तुति(अनुवाद) · सुरक्षित HTML पाठ",
        "note": "भीष्मस्तुतिका एघार श्लोकमा विषम/सम बाह्र–तेह्र अक्षरका पुष्पिताग्रा पाउ पढिएका: न न र य र न ज ज र ग। पादान्त लघु, अवग्रह र वर्णविन्यासका स्रोत-विचलन सुरक्षित छन्।"
      }
    ]
  }
}
