{
  "id": "sacho_haraeko_bela",
  "title": "साँचो हराएको बेला",
  "title_roman": "Sacho Haraeko Bela",
  "subtitle": null,
  "author": {
    "id": "devkota",
    "name": "लक्ष्मीप्रसाद देवकोटा",
    "name_roman": "Laxmi Prasad Devkota"
  },
  "language": "ne",
  "script": "Devanagari",
  "genre": [
    "git"
  ],
  "first_published": {
    "bs": null,
    "ad": null
  },
  "edition": "पहिलो; २०७५",
  "publisher": "मञ्जरी पब्लिकेशन",
  "description": "From the collection लक्ष्मी गीति-सङ्ग्रह. Transcribed from the identified Sahitya Ras source edition. Source wording and literary structure retained; not checked against printed pages.",
  "rights": {
    "status": "public-domain",
    "basis": "Author died 1959; Nepal's Copyright Act 2059 grants life + 50 years, expiring 2009."
  },
  "source": {
    "name": "Sahitya Ras (sahityaras.com)",
    "url": "https://sahityaras.com/book/laxmi-giti-sangraha/sacho-haraeko-bela/",
    "pdf": "sahityaras-laxmi-giti-sangraha.pdf",
    "html": "extracted/index.html",
    "pdf_editions": [
      {
        "id": "sahityaras-laxmi-giti-sangraha",
        "file": "sahityaras-laxmi-giti-sangraha.pdf",
        "kind": "typeset",
        "label": "साहित्यरस · लक्ष्मी गीति-सङ्ग्रह",
        "sha256": "c9e5f7272151b9d296c0ed3640186886d32c76b126c235d3208e4f843d6eb828",
        "page_count": 1,
        "origin": {
          "name": "Sahitya Ras",
          "url": "https://sahityaras.com/download.php?book=laxmi-giti-sangraha&format=pdf"
        },
        "sections": [
          {
            "label": "साँचो हराएको बेला",
            "page_start": 1,
            "page_end": 1
          }
        ]
      }
    ]
  },
  "pages": 1,
  "text": {
    "extraction_method": "html",
    "ocr_status": "born-digital",
    "proofread": false,
    "quality": null
  },
  "formats": {
    "pdf": "sahityaras-laxmi-giti-sangraha.pdf",
    "txt": "text.txt",
    "html": "reader.html",
    "epub": "reader.epub"
  },
  "added": "2026-09-08",
  "updated": "2026-09-09",
  "summary": "साँचो हराएको क्षणमा मानिस, समाज र आफ्नै अन्तःकरणमा फैलिएको भ्रमबारे छोटो कविताले चिन्ता व्यक्त गर्छ।",
  "prosody": {
    "status": "uncertain",
    "kind": "unresolved",
    "metres": [],
    "text_sha256": "e393c7eb4a06be58ee42ae9e8d75b9675d5abfc489e5f1668a4b413db2efb25f",
    "reviewed": "2026-10-31",
    "evidence": [
      {
        "basis": "editorial-reading",
        "file": "extracted/index.html",
        "sha256": "e37895fddc3eb08b89bb730afbf9e99810469961a6813040a8916895e15680f1",
        "locator": "साँचो हराएको बेला · सुरक्षित HTML पाठ",
        "note": "प्रारम्भिक त्रिपदी र सातपङ्क्ते खण्डमा कहाँ/जहाँ टेक तथा पर छ/घर छ तुक छन्; निश्चित मात्रिक भेद पुष्टि भएको छैन।"
      }
    ],
    "review_note": "प्रारम्भिक त्रिपदी र सातपङ्क्ते खण्डमा कहाँ/जहाँ टेक तथा पर छ/घर छ तुक छन्; निश्चित मात्रिक भेद पुष्टि भएको छैन।"
  }
}
