{
  "id": "bais",
  "title": "बैँस",
  "title_roman": "Bais",
  "subtitle": null,
  "author": {
    "id": "devkota",
    "name": "लक्ष्मीप्रसाद देवकोटा",
    "name_roman": "Laxmi Prasad Devkota"
  },
  "language": "ne",
  "script": "Devanagari",
  "genre": [
    "git"
  ],
  "first_published": {
    "bs": null,
    "ad": null
  },
  "edition": "पहिलो; २०७५",
  "publisher": "मञ्जरी पब्लिकेशन",
  "description": "From the collection लक्ष्मी गीति-सङ्ग्रह. Transcribed from the identified Sahitya Ras source edition. Source wording and literary structure retained; not checked against printed pages.",
  "rights": {
    "status": "public-domain",
    "basis": "Author died 1959; Nepal's Copyright Act 2059 grants life + 50 years, expiring 2009."
  },
  "source": {
    "name": "Sahitya Ras (sahityaras.com)",
    "url": "https://sahityaras.com/book/laxmi-giti-sangraha/baisa/",
    "pdf": "sahityaras-laxmi-giti-sangraha.pdf",
    "html": "extracted/index.html",
    "pdf_editions": [
      {
        "id": "sahityaras-laxmi-giti-sangraha",
        "file": "sahityaras-laxmi-giti-sangraha.pdf",
        "kind": "typeset",
        "label": "साहित्यरस · लक्ष्मी गीति-सङ्ग्रह",
        "sha256": "107ba24e2ed259568c337fb8704545aee319e33e46303987dfb26626995164f8",
        "page_count": 1,
        "origin": {
          "name": "Sahitya Ras",
          "url": "https://sahityaras.com/download.php?book=laxmi-giti-sangraha&format=pdf"
        },
        "sections": [
          {
            "label": "बैंस",
            "page_start": 1,
            "page_end": 1
          }
        ]
      }
    ]
  },
  "pages": 1,
  "text": {
    "extraction_method": "html",
    "ocr_status": "born-digital",
    "proofread": false,
    "quality": null
  },
  "formats": {
    "pdf": "sahityaras-laxmi-giti-sangraha.pdf",
    "txt": "text.txt",
    "html": "reader.html",
    "epub": "reader.epub"
  },
  "added": "2026-09-08",
  "updated": "2026-09-09",
  "summary": "कोपिला फुटेझैं उमेर, मुस्कान र चाहना फक्रँदा युवावस्थाको चुलबुल ऊर्जा र प्रेमिल सम्मोहनलाई चतुर्दशपदीमा गाइएको छ।",
  "prosody": {
    "status": "uncertain",
    "kind": "unresolved",
    "metres": [],
    "text_sha256": "4a66a48e6e587a2d3d0b75812dc51891c7755b7f9e8151f9c3f8086345a7c2a1",
    "reviewed": "2026-10-31",
    "evidence": [
      {
        "basis": "editorial-reading",
        "file": "extracted/index.html",
        "sha256": "721cda664b96839773b78bdde3ce90642b6f76d6ec03dbc72580e7f5366c323e",
        "locator": "बैँस · सुरक्षित HTML पाठ",
        "note": "स्रोतले चतुर्दशपदी भनेको चौध पङ्क्तिको तुकबद्ध काव्यरूप हो; त्यसबाट निश्चित मात्राछन्द वा वर्णछन्दको नाम निस्कँदैन।"
      }
    ],
    "review_note": "स्रोतले चतुर्दशपदी भनेको चौध पङ्क्तिको तुकबद्ध काव्यरूप हो; त्यसबाट निश्चित मात्राछन्द वा वर्णछन्दको नाम निस्कँदैन।"
  }
}
