{
  "id": "barsha_2",
  "title": "वर्षा",
  "title_roman": "Barsha",
  "subtitle": null,
  "author": {
    "id": "devkota",
    "name": "लक्ष्मीप्रसाद देवकोटा",
    "name_roman": "Laxmi Prasad Devkota"
  },
  "language": "ne",
  "script": "Devanagari",
  "genre": [
    "kavita",
    "poem"
  ],
  "first_published": {
    "bs": null,
    "ad": null
  },
  "edition": null,
  "publisher": null,
  "description": "Devkota's lyric on the arrival of the monsoon — a separate poem from his children's-collection वर्षा (सुनको बिहान).",
  "rights": {
    "status": "public-domain",
    "basis": "Author died 1959; Nepal's Copyright Act 2059 grants life + 50 years, expiring 2009."
  },
  "source": {
    "name": "iNepal (inepal.org)",
    "url": "https://inepal.org/nepalipoems/960/laxmi-prasad-devkota-barsha/",
    "pdf": null,
    "html": "extracted/index.html"
  },
  "pages": null,
  "text": {
    "extraction_method": "html",
    "ocr_status": "born-digital",
    "proofread": false,
    "quality": "good"
  },
  "formats": {
    "pdf": null,
    "txt": "text.txt",
    "html": "reader.html",
    "epub": "reader.epub"
  },
  "added": "2026-06-05",
  "updated": "2026-09-09",
  "summary": "वायुपङ्खी विमानमा आएकी वरुणपुत्री वर्षाले मोतीझैँ जल वर्षाएर धूलो पखाल्ने, धान फलाउने र वनप्राणीलाई तृप्त पार्ने उत्सव देखाइएको छ।",
  "prosody": {
    "status": "reviewed",
    "kind": "single",
    "metres": [
      "mandakranta"
    ],
    "text_sha256": "996965c972d8386722bc430585da7d16565f7fc7ad3cdee101af18e54a5faf83",
    "reviewed": "2026-10-30",
    "evidence": [
      {
        "basis": "metrical-reading",
        "file": "extracted/index.html",
        "sha256": "5bd271eed956000aaeb8e613d114daa21c8acbfd8484d83e35beb8b3b6aa7a35",
        "locator": "पूर्ण कविता",
        "note": "साठी पाउमा मन्दाक्रान्ताको सत्र-अक्षरीय लय र ४/६/७ विभाजन पढिएको। “देखिंदै”, “सम्झिंदा”, “लच्किंदा”, “फर्फर” र “जगत् छहरी” लगायतका स्रोत-वर्तनीले शाब्दिक अपवाद दिन्छन्। शाब्दिक प्रारम्भिक जाँच: 49/60 पाउ (पदान्त लघुको छुटसहित)। यो समग्र छन्दको पहिचान हो; प्रत्येक पाउ निर्दोष छ भन्ने प्रमाणीकरण होइन।"
      }
    ]
  }
}
