{
  "id": "mohan_moh_rahechh_apar",
  "title": "मोहन ! मोह रहेछ अपार",
  "title_roman": "Mohan Moh Rahechh Apar",
  "subtitle": null,
  "author": {
    "id": "bhimnidhi_tiwari",
    "name": "भीमनिधि तिवारी",
    "name_roman": "Bhimnidhi Tiwari"
  },
  "language": "ne",
  "script": "Devanagari",
  "genre": [
    "bhajan",
    "hymn"
  ],
  "first_published": {
    "bs": 2010,
    "ad": null
  },
  "edition": "प्रथम संस्करण, २०१० वि.सं., १००० प्रति; मुद्रक श्री पशुपति प्रेस, काठमाडौँ",
  "publisher": "भीमनिधि तिवारी",
  "description": "From the collection बयासी भजन. पुस्तकको भजन-सूचीमा नं. ११, पृष्ठ ८।",
  "rights": {
    "status": "public-domain",
    "basis": "Author died 1973; Nepal's Copyright Act 2059 grants life + 50 years."
  },
  "source": {
    "name": "बयासी भजन (२०१०) — लेखक-प्रकाशक भीमनिधि तिवारी",
    "url": null,
    "pdf": "mohan_moh_rahechh_apar.pdf",
    "html": null,
    "pdf_editions": [
      {
        "id": "ia-bayasi-bhajan",
        "file": "mohan_moh_rahechh_apar.pdf",
        "kind": "scan",
        "label": "बयासी भजन — भजन नं. ११ (पृ. ८)",
        "sha256": "524f7b11f49754755c4b4a917371b9ffca62fa9cd767f6b57cae1cd4c9cc9a83",
        "page_count": 1,
        "origin": {
          "name": "Internet Archive",
          "url": "https://archive.org/details/fceb-bayasi-bhajan-by-bhimnidhi-tiwari-nepali-bhajan-il"
        },
        "sections": [
          {
            "label": "मोहन ! मोह रहेछ अपार",
            "page_start": 1,
            "page_end": 1
          }
        ]
      }
    ]
  },
  "pages": 1,
  "text": {
    "extraction_method": "ocr",
    "ocr_status": "ocr-done",
    "proofread": false,
    "quality": "good"
  },
  "formats": {
    "pdf": "mohan_moh_rahechh_apar.pdf",
    "txt": "text.txt",
    "html": null,
    "epub": null
  },
  "added": "2026-09-18",
  "updated": "2026-09-19",
  "summary": "अस्थायी शरीर, परिवार, भोगविलास र घरबारलाई मृगतृष्णा तथा विष ठानेर पनि मानिस त्यसैमा डुबिरहने मोहको आलोचना गर्ने भजन।",
  "prosody": {
    "status": "uncertain",
    "kind": "unresolved",
    "metres": [],
    "text_sha256": "aacadf5fc6fd22e179207ee38f21112f22abc75fd23e2eef95ada96fcd370cc6",
    "reviewed": "2026-10-31",
    "evidence": [
      {
        "basis": "editorial-reading",
        "file": "mohan_moh_rahechh_apar.pdf",
        "sha256": "524f7b11f49754755c4b4a917371b9ffca62fa9cd767f6b57cae1cd4c9cc9a83",
        "locator": "मोहन ! मोह रहेछ अपार · सुरक्षित PDF मा यस शीर्षकको काव्यपाठ",
        "note": "बयासी भजनको मूल पृष्ठमा “मोहन ! मोह रहेछ अपार” बाट उठ्ने गेय पद, ध्रुवपद/तुकान्त र अन्तराको विन्यास पढिएको। अन्त्यको “मोहन ! मोह रहेछ अपार” सहित गीतमा फर्किने चाल छ। निश्चित छन्द/तालको नाम र मात्रिक उपभेद स्रोतले नखुलाएकाले अनिश्चित राखिएको; शास्त्रीय मिलान नपाएको भरमा मुक्तछन्द भनिएको छैन।"
      }
    ],
    "review_note": "बयासी भजनको मूल पृष्ठमा “मोहन ! मोह रहेछ अपार” बाट उठ्ने गेय पद, ध्रुवपद/तुकान्त र अन्तराको विन्यास पढिएको। अन्त्यको “मोहन ! मोह रहेछ अपार” सहित गीतमा फर्किने चाल छ। निश्चित छन्द/तालको नाम र मात्रिक उपभेद स्रोतले नखुलाएकाले अनिश्चित राखिएको; शास्त्रीय मिलान नपाएको भरमा मुक्तछन्द भनिएको छैन।"
  }
}
