{
  "id": "ganggajisit",
  "title": "गङ्गाजीसित",
  "title_roman": "Ganggajisit",
  "subtitle": null,
  "author": {
    "id": "lekhnath_paudyal",
    "name": "लेखनाथ पौड्याल",
    "name_roman": "Lekhnath Paudyal"
  },
  "language": "ne",
  "script": "Devanagari",
  "genre": [
    "kavita"
  ],
  "first_published": {
    "bs": null,
    "ad": null
  },
  "edition": "पहिलो; २०७६",
  "publisher": "मञ्जरी पब्लिकेशन",
  "description": "From the collection लालित्य भाग १. Transcribed from the identified Sahitya Ras source edition. Source wording and literary structure retained; not checked against printed pages.",
  "rights": {
    "status": "public-domain",
    "basis": "Author died 1966; public domain since 2016 (Nepal's Copyright Act 2059: life + 50 years)."
  },
  "source": {
    "name": "Sahitya Ras (sahityaras.com)",
    "url": "https://sahityaras.com/book/lalitya-bhag-1/gangajisita/",
    "pdf": "sahityaras-lalitya-bhag-1.pdf",
    "html": "extracted/index.html",
    "pdf_editions": [
      {
        "id": "sahityaras-lalitya-bhag-1",
        "file": "sahityaras-lalitya-bhag-1.pdf",
        "kind": "typeset",
        "label": "साहित्यरस · लालित्य भाग १",
        "sha256": "05f2d842dc43fc65380071653047030fae1bc95a69682513b5d706475488a440",
        "page_count": 1,
        "origin": {
          "name": "Sahitya Ras",
          "url": "https://sahityaras.com/download.php?book=lalitya-bhag-1&format=pdf"
        },
        "sections": [
          {
            "label": "गङ्गाजीसित",
            "page_start": 1,
            "page_end": 1
          }
        ]
      }
    ]
  },
  "pages": 1,
  "text": {
    "extraction_method": "html",
    "ocr_status": "born-digital",
    "proofread": false,
    "quality": null
  },
  "formats": {
    "pdf": "sahityaras-lalitya-bhag-1.pdf",
    "txt": "text.txt",
    "html": "reader.html",
    "epub": "reader.epub"
  },
  "added": "2026-09-08",
  "updated": "2026-09-09",
  "summary": "स्वर्गबाट शिवको जटामा, हिमाल र मैदान हुँदै वेगले बगेकी गङ्गाको यौवन क्रमशः झुकेर अन्ततः सागरमा डुबेको यात्रालाई मानव जीवनसँग मिल्ने गरी सम्बोधन गरिएको छ।",
  "prosody": {
    "status": "reviewed",
    "kind": "single",
    "metres": [
      "shardul"
    ],
    "text_sha256": "f9959c2efc0cc9a1ac39f8f1c82fe00693d890055477da6dee96c0de2ba28bfc",
    "reviewed": "2026-10-31",
    "evidence": [
      {
        "basis": "metrical-reading",
        "file": "extracted/index.html",
        "sha256": "6055f1ce05c8d0a0ea68e86ca37dfc05c0942c1e09dcb59867b46177a4019415",
        "locator": "गङ्गाजीसित · सुरक्षित HTML पाठ",
        "note": "गङ्गाको स्वर्गदेखि सागरसम्मको दुई श्लोकमा शार्दूल लय पढिएको; जटाजूट, खिहिर्‍याउँदो र पङ्क्तिगत संयुक्ताक्षरका स्रोत-पठन अपवाद सुरक्षित छन्।"
      }
    ]
  }
}
