{
  "id": "ek_tarangga",
  "title": "एक तरङ्ग",
  "title_roman": "Ek Tarangga",
  "subtitle": null,
  "author": {
    "id": "devkota",
    "name": "लक्ष्मीप्रसाद देवकोटा",
    "name_roman": "Laxmi Prasad Devkota"
  },
  "language": "ne",
  "script": "Devanagari",
  "genre": [
    "kavita",
    "poem"
  ],
  "first_published": {
    "bs": null,
    "ad": null
  },
  "edition": null,
  "publisher": null,
  "description": "From the collection लक्ष्मी कवितासङ्ग्रह.",
  "rights": {
    "status": "public-domain",
    "basis": "Author died 1959; Nepal's Copyright Act 2059 grants life + 50 years, expiring 2009."
  },
  "source": {
    "name": "Kavita Kosh (kavitakosh.org)",
    "url": "https://kavitakosh.org/kk/एक_तरङ्ग_/_लक्ष्मीप्रसाद_देवकोटा",
    "pdf": null,
    "html": "extracted/index.html"
  },
  "pages": null,
  "text": {
    "extraction_method": "html",
    "ocr_status": "born-digital",
    "proofread": false,
    "quality": "good"
  },
  "formats": {
    "pdf": null,
    "txt": "text.txt",
    "html": "reader.html",
    "epub": "reader.epub"
  },
  "added": "2026-06-05",
  "updated": "2026-09-09",
  "summary": "मनमा अचानक उठेको भावना, स्मृति र कल्पनाको एक लहरले चेतनालाई छोएको कविता।",
  "prosody": {
    "status": "uncertain",
    "kind": "unresolved",
    "metres": [],
    "text_sha256": "1003a9c6e9361b0993588e0db8d1a0f9457bc5ab5de8f765bc047367a5a6577f",
    "reviewed": "2026-10-31",
    "evidence": [
      {
        "basis": "editorial-reading",
        "file": "extracted/index.html",
        "sha256": "4e06c961619f6d9b5763d4ef878855d6e5478e263716a0135fe618fa978a0e53",
        "locator": "एक तरङ्ग · सुरक्षित HTML पाठ",
        "note": "आठ खण्डमा झस्काइको कथन र एकशब्दीय संस्कृत प्रश्न/जवाफ छन्; तुक र विरामको पुनरावृत्ति भए पनि नामाङ्कित मात्रा-रचना स्थापित छैन।"
      }
    ],
    "review_note": "आठ खण्डमा झस्काइको कथन र एकशब्दीय संस्कृत प्रश्न/जवाफ छन्; तुक र विरामको पुनरावृत्ति भए पनि नामाङ्कित मात्रा-रचना स्थापित छैन।"
  }
}
