{
  "id": "gunaso",
  "title": "गुनासो",
  "title_roman": "Gunaso",
  "subtitle": null,
  "author": {
    "id": "gopalaprasad_rimal",
    "name": "गोपालप्रसाद रिमाल",
    "name_roman": "Gopal Prasad Rimal"
  },
  "language": "ne",
  "script": "Devanagari",
  "genre": [
    "kavita"
  ],
  "first_published": {
    "bs": null,
    "ad": null
  },
  "edition": "नवौँ; २०७६",
  "publisher": "साझा प्रकाशन",
  "description": "From the collection आमाको सपना. Transcribed from the identified Sahitya Ras source edition. Source wording and literary structure retained; not checked against printed pages.",
  "rights": {
    "status": "public-domain",
    "basis": "Author died 1973; Nepal's Copyright Act 2059 grants life + 50 years."
  },
  "source": {
    "name": "Sahitya Ras (sahityaras.com)",
    "url": "https://sahityaras.com/book/aamako-sapana/gunaso/",
    "pdf": "sahityaras-aamako-sapana.pdf",
    "html": "extracted/index.html",
    "pdf_editions": [
      {
        "id": "sahityaras-aamako-sapana",
        "file": "sahityaras-aamako-sapana.pdf",
        "kind": "typeset",
        "label": "साहित्यरस · आमाको सपना",
        "sha256": "6c62da359543a602a42d1d1ffdd07eec0726eb9ec517dba21cc188d903b7b545",
        "page_count": 2,
        "origin": {
          "name": "Sahitya Ras",
          "url": "https://sahityaras.com/download.php?book=aamako-sapana&format=pdf"
        },
        "sections": [
          {
            "label": "गुनासो",
            "page_start": 1,
            "page_end": 2
          }
        ]
      }
    ]
  },
  "pages": 2,
  "text": {
    "extraction_method": "html",
    "ocr_status": "born-digital",
    "proofread": false,
    "quality": null
  },
  "formats": {
    "pdf": "sahityaras-aamako-sapana.pdf",
    "txt": "text.txt",
    "html": "reader.html",
    "epub": "reader.epub"
  },
  "added": "2026-09-08",
  "updated": "2026-09-09",
  "summary": "वक्ताले प्रिय, समाज वा भाग्यसँग आफ्ना उपेक्षा र पीडाका गुनासा राख्दै सुन्ने कान खोज्छन्।",
  "prosody": {
    "status": "reviewed",
    "kind": "free-verse",
    "metres": [],
    "text_sha256": "c3ae4f8f14b0fa97b31b71ac9be905dfb1487c9480ee9e15523dac82da1ce419",
    "reviewed": "2026-10-30",
    "evidence": [
      {
        "basis": "editorial-reading",
        "file": "extracted/index.html",
        "sha256": "806fbb5b7711a4c95d1d5bf4ac3c9d7877ba375994f46a99a4bb1a2b999e2780",
        "locator": "पूर्ण कविता",
        "note": "छोटा उद्गार र लामा वाक्यको फेरबदल तथा “म नमरूँ” को पुनरावृत्तिमा बनेको मुक्त काव्यलय समीक्षा गरिएको।"
      }
    ]
  }
}
