{
  "id": "mali",
  "title": "माली",
  "title_roman": "Mali",
  "subtitle": null,
  "author": {
    "id": "devkota",
    "name": "लक्ष्मीप्रसाद देवकोटा",
    "name_roman": "Laxmi Prasad Devkota"
  },
  "language": "ne",
  "script": "Devanagari",
  "genre": [
    "kavita"
  ],
  "first_published": {
    "bs": null,
    "ad": null
  },
  "edition": "अठारौँ; २०६०",
  "publisher": "साझा प्रकाशन",
  "description": "From the collection भिखारी (कवितासङ्ग्रह). Transcribed from the identified Sahitya Ras source edition. Source wording and literary structure retained; not checked against printed pages.",
  "rights": {
    "status": "public-domain",
    "basis": "Author died 1959; Nepal's Copyright Act 2059 grants life + 50 years, expiring 2009."
  },
  "source": {
    "name": "Sahitya Ras (sahityaras.com)",
    "url": "https://sahityaras.com/book/bhikari/maali/",
    "pdf": "sahityaras-bhikari.pdf",
    "html": "extracted/index.html",
    "pdf_editions": [
      {
        "id": "sahityaras-bhikari",
        "file": "sahityaras-bhikari.pdf",
        "kind": "typeset",
        "label": "साहित्यरस · भिखारी",
        "sha256": "90fb56252033363fb25fa580698a45d0495b38eb941f419d4b0fc8c33ef00b43",
        "page_count": 2,
        "origin": {
          "name": "Sahitya Ras",
          "url": "https://sahityaras.com/download.php?book=bhikari&format=pdf"
        },
        "sections": [
          {
            "label": "माली",
            "page_start": 1,
            "page_end": 2
          }
        ]
      }
    ]
  },
  "pages": 2,
  "text": {
    "extraction_method": "html",
    "ocr_status": "born-digital",
    "proofread": false,
    "quality": null
  },
  "formats": {
    "pdf": "sahityaras-bhikari.pdf",
    "txt": "text.txt",
    "html": "reader.html",
    "epub": "reader.epub"
  },
  "added": "2026-09-08",
  "updated": "2026-09-09",
  "summary": "मालीले फूल र बगैँचा स्याहारेजस्तै श्रम, धैर्य र प्रेमले जीवन सुन्दर बनाउने बिम्ब कविताको आधार हो।",
  "prosody": {
    "status": "uncertain",
    "kind": "unresolved",
    "metres": [],
    "text_sha256": "29c74a7db66c1b7c22713dc5cdc653c42ed741043b3c77a089d3a071b087e0f4",
    "reviewed": "2026-10-31",
    "evidence": [
      {
        "basis": "editorial-reading",
        "file": "extracted/index.html",
        "sha256": "90c09f027dab0d49a40608f7b1a883a582fdffe79de559b299944c59e2fa2b73",
        "locator": "माली · सुरक्षित HTML पाठ",
        "note": "चार मुख्य खण्डमा युग्मपछि भित्र सारिएका छोटा/लामा तुकान्त पद छन्; बगैँचाको गीतविन्यासको निश्चित मात्रा-छन्द खुलेन।"
      }
    ],
    "review_note": "चार मुख्य खण्डमा युग्मपछि भित्र सारिएका छोटा/लामा तुकान्त पद छन्; बगैँचाको गीतविन्यासको निश्चित मात्रा-छन्द खुलेन।"
  }
}
