{
  "id": "bhautikabadaka_khiyaharu_chhan",
  "title": "भौतिकवादका खियाहरु छन्",
  "title_roman": "Bhautikabadaka Khiyaharu Chhan",
  "subtitle": null,
  "author": {
    "id": "bhimnidhi_tiwari",
    "name": "भीमनिधि तिवारी",
    "name_roman": "Bhimnidhi Tiwari"
  },
  "language": "ne",
  "script": "Devanagari",
  "genre": [
    "bhajan",
    "hymn"
  ],
  "first_published": {
    "bs": 2010,
    "ad": null
  },
  "edition": "प्रथम संस्करण, २०१० वि.सं., १००० प्रति; मुद्रक श्री पशुपति प्रेस, काठमाडौँ",
  "publisher": "भीमनिधि तिवारी",
  "description": "From the collection बयासी भजन. पुस्तकको भजन-सूचीमा नं. ५५, पृष्ठ ३७।",
  "rights": {
    "status": "public-domain",
    "basis": "Author died 1973; Nepal's Copyright Act 2059 grants life + 50 years."
  },
  "source": {
    "name": "बयासी भजन (२०१०) — लेखक-प्रकाशक भीमनिधि तिवारी",
    "url": null,
    "pdf": "bhautikabadaka_khiyaharu_chhan.pdf",
    "html": null,
    "pdf_editions": [
      {
        "id": "ia-bayasi-bhajan",
        "file": "bhautikabadaka_khiyaharu_chhan.pdf",
        "kind": "scan",
        "label": "बयासी भजन — भजन नं. ५५ (पृ. ३७)",
        "sha256": "3f980e31ec253bb40c1b1ed42f9d3ad09c8e48801c0f4ee10ae8762fdccabf40",
        "page_count": 2,
        "origin": {
          "name": "Internet Archive",
          "url": "https://archive.org/details/fceb-bayasi-bhajan-by-bhimnidhi-tiwari-nepali-bhajan-il"
        },
        "sections": [
          {
            "label": "भौतिकवादका खियाहरु छन्",
            "page_start": 1,
            "page_end": 2
          }
        ]
      }
    ]
  },
  "pages": 2,
  "text": {
    "extraction_method": "ocr",
    "ocr_status": "ocr-done",
    "proofread": false,
    "quality": "good"
  },
  "formats": {
    "pdf": "bhautikabadaka_khiyaharu_chhan.pdf",
    "txt": "text.txt",
    "html": null,
    "epub": null
  },
  "added": "2026-09-18",
  "updated": "2026-09-19",
  "summary": "लोभ-पापले बेसुरा हृदयलाई भक्तिले माझेर झंकार ल्याउने रूपक।",
  "prosody": {
    "status": "uncertain",
    "kind": "unresolved",
    "metres": [],
    "text_sha256": "22090f841c830cb38e4ecfd21b7674f8f54409742cc79706afc17031d51bc053",
    "reviewed": "2026-10-31",
    "evidence": [
      {
        "basis": "editorial-reading",
        "file": "bhautikabadaka_khiyaharu_chhan.pdf",
        "sha256": "3f980e31ec253bb40c1b1ed42f9d3ad09c8e48801c0f4ee10ae8762fdccabf40",
        "locator": "भौतिकवादका खियाहरु छन् · सुरक्षित PDF मा यस शीर्षकको काव्यपाठ",
        "note": "बयासी भजनको मूल पृष्ठमा “भौतिकवादका खियाहरु छन्” बाट उठ्ने गेय पद, ध्रुवपद/तुकान्त र अन्तराको विन्यास पढिएको। अन्त्यको “अनि देला झंकार” सहित गीतमा फर्किने चाल छ। निश्चित छन्द/तालको नाम र मात्रिक उपभेद स्रोतले नखुलाएकाले अनिश्चित राखिएको; शास्त्रीय मिलान नपाएको भरमा मुक्तछन्द भनिएको छैन।"
      }
    ],
    "review_note": "बयासी भजनको मूल पृष्ठमा “भौतिकवादका खियाहरु छन्” बाट उठ्ने गेय पद, ध्रुवपद/तुकान्त र अन्तराको विन्यास पढिएको। अन्त्यको “अनि देला झंकार” सहित गीतमा फर्किने चाल छ। निश्चित छन्द/तालको नाम र मात्रिक उपभेद स्रोतले नखुलाएकाले अनिश्चित राखिएको; शास्त्रीय मिलान नपाएको भरमा मुक्तछन्द भनिएको छैन।"
  }
}
