{
  "id": "jiban",
  "title": "जीवन",
  "title_roman": "Jiban",
  "subtitle": null,
  "author": {
    "id": "devkota",
    "name": "लक्ष्मीप्रसाद देवकोटा",
    "name_roman": "Laxmi Prasad Devkota"
  },
  "language": "ne",
  "script": "Devanagari",
  "genre": [
    "kavita",
    "poem"
  ],
  "first_published": {
    "bs": null,
    "ad": null
  },
  "edition": null,
  "publisher": null,
  "description": "From the collection भिखारी (कवितासङ्ग्रह).",
  "rights": {
    "status": "public-domain",
    "basis": "Author died 1959; Nepal's Copyright Act 2059 grants life + 50 years, expiring 2009."
  },
  "source": {
    "name": "Kavita Kosh (kavitakosh.org)",
    "url": "https://kavitakosh.org/kk/जीवन_/_लक्ष्मीप्रसाद_देवकोटा",
    "pdf": "sahityaras-bhikari.pdf",
    "html": "extracted/index.html",
    "pdf_editions": [
      {
        "id": "sahityaras-bhikari",
        "file": "sahityaras-bhikari.pdf",
        "kind": "typeset",
        "label": "साहित्यरस · भिखारी",
        "sha256": "737a37e606051f83261917d07073182fe9c350eecf0abd7015315c4970f8d041",
        "page_count": 2,
        "origin": {
          "name": "Sahitya Ras",
          "url": "https://sahityaras.com/download.php?book=bhikari&format=pdf"
        },
        "sections": [
          {
            "label": "जीवन",
            "page_start": 1,
            "page_end": 2
          }
        ]
      }
    ]
  },
  "pages": 2,
  "text": {
    "extraction_method": "html",
    "ocr_status": "born-digital",
    "proofread": false,
    "quality": "good"
  },
  "formats": {
    "pdf": "sahityaras-bhikari.pdf",
    "txt": "text.txt",
    "html": "reader.html",
    "epub": "reader.epub"
  },
  "added": "2026-06-05",
  "updated": "2026-09-09",
  "summary": "जन्मदेखि मृत्युबीच बग्ने जीवनलाई क्षणिक यात्रा मानी कविताले सुख, दुःख र कर्मका मोडहरूमा अर्थ खोज्छ।",
  "prosody": {
    "status": "uncertain",
    "kind": "unresolved",
    "metres": [],
    "text_sha256": "34cce2470059bb2f19abeeb0eac7cb7404ac217593427ec7af47c2b55c8fe60a",
    "reviewed": "2026-10-31",
    "evidence": [
      {
        "basis": "editorial-reading",
        "file": "extracted/index.html",
        "sha256": "53eda1e22419c9cbfeb043ee4e0155f2c5a7e8661aa097a676558e5f169fff01",
        "locator": "जीवन · सुरक्षित HTML पाठ",
        "note": "आठ चौपदीमा जीवनका चरणसँग तुक र लामा/छोटा पदको पालो दोहोरिन्छ; निश्चित मात्रिक छन्दको नाम अझ अनिर्णीत।"
      }
    ],
    "review_note": "आठ चौपदीमा जीवनका चरणसँग तुक र लामा/छोटा पदको पालो दोहोरिन्छ; निश्चित मात्रिक छन्दको नाम अझ अनिर्णीत।"
  }
}
