{
  "id": "pani",
  "title": "पानी",
  "title_roman": "Pani",
  "subtitle": null,
  "author": {
    "id": "devkota",
    "name": "लक्ष्मीप्रसाद देवकोटा",
    "name_roman": "Laxmi Prasad Devkota"
  },
  "language": "ne",
  "script": "Devanagari",
  "genre": [
    "kavita",
    "poem"
  ],
  "first_published": {
    "bs": null,
    "ad": null
  },
  "edition": null,
  "publisher": null,
  "description": "From the collection लक्ष्मी कवितासङ्ग्रह.",
  "rights": {
    "status": "public-domain",
    "basis": "Author died 1959; Nepal's Copyright Act 2059 grants life + 50 years, expiring 2009."
  },
  "source": {
    "name": "Kavita Kosh (kavitakosh.org)",
    "url": "https://kavitakosh.org/kk/पानी_/_लक्ष्मीप्रसाद_देवकोटा",
    "pdf": null,
    "html": "extracted/index.html"
  },
  "pages": null,
  "text": {
    "extraction_method": "html",
    "ocr_status": "born-digital",
    "proofread": false,
    "quality": "good"
  },
  "formats": {
    "pdf": null,
    "txt": "text.txt",
    "html": "reader.html",
    "epub": "reader.epub"
  },
  "added": "2026-06-05",
  "updated": "2026-09-09",
  "summary": "पानीलाई बादल, वर्षा, नदी र जीवनका सबै तह जोड्ने तत्त्वका रूपमा पछ्याउँदै कविताले यसको रूप, गति र अपरिहार्यता देखाउँछ।",
  "prosody": {
    "status": "uncertain",
    "kind": "unresolved",
    "metres": [],
    "text_sha256": "8c6b0299b59ad9ee3f48624b273c966b7d9b67df44aee6921c58bd4e06ff54d0",
    "reviewed": "2026-10-31",
    "evidence": [
      {
        "basis": "editorial-reading",
        "file": "extracted/index.html",
        "sha256": "996bddb2757cea61e283bcdd5e3605404982e4ee823753f37466ab369b31760c",
        "locator": "पानी · सुरक्षित HTML पाठ",
        "note": "एघार खण्डको पानी-रानी टेकमा छोटा ध्वनिपद, सूची र लामा तुकान्त कथन मिसिन्छन्; यो विषम गेय संरचनाको निश्चित मात्रिक नाम खुलेन।"
      }
    ],
    "review_note": "एघार खण्डको पानी-रानी टेकमा छोटा ध्वनिपद, सूची र लामा तुकान्त कथन मिसिन्छन्; यो विषम गेय संरचनाको निश्चित मात्रिक नाम खुलेन।"
  }
}
