{
  "id": "shraddhanyjali",
  "title": "श्रद्धाऽऽञ्जलि",
  "title_roman": "Shraddhanyjali",
  "subtitle": null,
  "author": {
    "id": "lekhnath_paudyal",
    "name": "लेखनाथ पौड्याल",
    "name_roman": "Lekhnath Paudyal"
  },
  "language": "ne",
  "script": "Devanagari",
  "genre": [
    "kavita"
  ],
  "first_published": {
    "bs": null,
    "ad": null
  },
  "edition": "पहिलो; २०७६",
  "publisher": "मञ्जरी पब्लिकेशन",
  "description": "From the collection लालित्य भाग २. Transcribed from the identified Sahitya Ras source edition. Source wording and literary structure retained; not checked against printed pages.",
  "rights": {
    "status": "public-domain",
    "basis": "Author died 1966; public domain since 2016 (Nepal's Copyright Act 2059: life + 50 years)."
  },
  "source": {
    "name": "Sahitya Ras (sahityaras.com)",
    "url": "https://sahityaras.com/book/lalitya-bhag-2/shraddhanjali/",
    "pdf": "sahityaras-lalitya-bhag-2.pdf",
    "html": "extracted/index.html",
    "pdf_editions": [
      {
        "id": "sahityaras-lalitya-bhag-2",
        "file": "sahityaras-lalitya-bhag-2.pdf",
        "kind": "typeset",
        "label": "साहित्यरस · लालित्य भाग २",
        "sha256": "292c8ef81f27d4c8bd9ae12e4b4722f388c236caeae3c23da92312ef982e8fe2",
        "page_count": 4,
        "origin": {
          "name": "Sahitya Ras",
          "url": "https://sahityaras.com/download.php?book=lalitya-bhag-2&format=pdf"
        },
        "sections": [
          {
            "label": "श्रद्धाऽऽञ्जलि",
            "page_start": 1,
            "page_end": 4
          }
        ]
      }
    ]
  },
  "pages": 4,
  "text": {
    "extraction_method": "html",
    "ocr_status": "born-digital",
    "proofread": false,
    "quality": null
  },
  "formats": {
    "pdf": "sahityaras-lalitya-bhag-2.pdf",
    "txt": "text.txt",
    "html": "reader.html",
    "epub": "reader.epub"
  },
  "added": "2026-09-08",
  "updated": "2026-09-09",
  "summary": "नेपाल र नेपाली कवितालाई उज्यालो बनाउने भानुभक्तको जन्मजयन्तीमा अर्पित श्रद्धा र कृतज्ञताको पुष्पाञ्जलि।",
  "prosody": {
    "status": "reviewed",
    "kind": "single",
    "metres": [
      "sragdhara"
    ],
    "text_sha256": "5139be2f470e60bed7cda7eb9eb0c965afedf06ba83e532c66589cc342c740b9",
    "reviewed": "2026-10-30",
    "evidence": [
      {
        "basis": "metrical-reading",
        "file": "extracted/index.html",
        "sha256": "613cd9a0420e69c01be6eda0740cb35cf23768de004f61ee15ab1a5b874e01fe",
        "locator": "पूर्ण कविता",
        "note": "सोह्र श्लोकको स्रग्धरा लय पढिएको। आरम्भको “अग्ला अग्ला”, “जस्का छन्” र अवग्रहयुक्त पाउमा स्रोतपाठीय अपवाद छन्। ऐतिहासिक काव्यकथनलाई यस समीक्षाले सम्पादन गरेको छैन। पहिचान समग्र आवर्ती वृत्तको हो; यसले प्रत्येक पाउ निर्दोष छ वा पाठको प्रूफरीडिङ सकिएको छ भन्ने प्रमाणित गर्दैन।"
      }
    ]
  }
}
