{
  "id": "chadbad",
  "title": "चाडबाड",
  "title_roman": "Chadbad",
  "subtitle": "२०२७ दसैं",
  "author": {
    "id": "bhimnidhi_tiwari",
    "name": "भीमनिधि तिवारी",
    "name_roman": "Bhimnidhi Tiwari"
  },
  "language": "ne",
  "script": "Devanagari",
  "genre": [
    "kavita",
    "poem"
  ],
  "first_published": {
    "bs": 2027,
    "ad": null
  },
  "edition": null,
  "publisher": "कौवा प्रकाशन",
  "description": "भीमनिधि तिवारीको व्यङ्ग्य कविता; वर्षभरिका चाडपर्वको क्रम पछ्याउँदै समाज र राजनीतिको चित्रण गर्ने बत्तीस श्लोकको रचना।",
  "rights": {
    "status": "public-domain",
    "basis": "Author died 1973; Nepal's Copyright Act 2059 grants life + 50 years."
  },
  "source": {
    "name": "चाडबाड (२०२७ दसैं) — कौवा प्रकाशन",
    "url": null,
    "pdf": "chadbad.pdf",
    "html": null,
    "pdf_editions": [
      {
        "id": "sahityaras-chadbad",
        "file": "sahityaras-chadbad.pdf",
        "kind": "typeset",
        "label": "साहित्यरस · चाडबाड",
        "sha256": "1d45cd4be3904e0d1d8f053ed50176e4f4d73de2bc3c29b03ffa1831e78349ee",
        "page_count": 8,
        "origin": {
          "name": "Sahitya Ras",
          "url": "https://sahityaras.com/download.php?book=chadbad&format=pdf"
        },
        "sections": [
          {
            "label": "चाडबाड",
            "page_start": 1,
            "page_end": 8
          }
        ]
      }
    ]
  },
  "pages": 8,
  "text": {
    "extraction_method": "ocr",
    "ocr_status": "ocr-done",
    "proofread": true,
    "quality": "good"
  },
  "formats": {
    "pdf": "chadbad.pdf",
    "txt": "text.txt",
    "html": "reader.html",
    "epub": "reader.epub"
  },
  "added": "2026-07-26",
  "updated": "2026-10-31",
  "summary": "ऋण, महँगी र अभावबीच आउने चाडबाडले गरिब परिवारलाई आनन्दभन्दा खर्च र चिन्ताको बोझ दिएको चित्र।",
  "prosody": {
    "status": "uncertain",
    "kind": "unresolved",
    "metres": [],
    "text_sha256": "c0c68b46c8cdafc399e9d7d3d23187b83c4816804c2f52ec34a1fa5906c0f7d9",
    "reviewed": "2026-10-31",
    "evidence": [
      {
        "basis": "editorial-reading",
        "file": "chadbad.pdf",
        "sha256": "316e2744f699f9516cd40c94e7b54801509f864dc142a1b2a5a2daaeea299716",
        "locator": "चाडबाड · सुरक्षित PDF मा यस शीर्षकको काव्यपाठ",
        "note": "चाडबाडका बत्तीस व्यङ्ग्य-चौपदीमा झैँ लाग्छ अन्त्य र लामा तुकान्त वाक्य छन्। पूरै मुद्रित काव्य (PDF ४–११, पृ. १–८) पढिएको; स्वर/मात्रा-विभाजनको निश्चित नाम बाँकी छ। यसलाई नमिलेकै आधारमा मुक्तछन्द मानिएको छैन।"
      }
    ],
    "review_note": "चाडबाडका बत्तीस व्यङ्ग्य-चौपदीमा झैँ लाग्छ अन्त्य र लामा तुकान्त वाक्य छन्। पूरै मुद्रित काव्य (PDF ४–११, पृ. १–८) पढिएको; स्वर/मात्रा-विभाजनको निश्चित नाम बाँकी छ। यसलाई नमिलेकै आधारमा मुक्तछन्द मानिएको छैन।"
  }
}
