{
  "id": "git",
  "title": "गीत",
  "title_roman": "Git",
  "subtitle": null,
  "author": {
    "id": "gopalaprasad_rimal",
    "name": "गोपालप्रसाद रिमाल",
    "name_roman": "Gopal Prasad Rimal"
  },
  "language": "ne",
  "script": "Devanagari",
  "genre": [
    "kavita"
  ],
  "first_published": {
    "bs": null,
    "ad": null
  },
  "edition": "नवौँ; २०७६",
  "publisher": "साझा प्रकाशन",
  "description": "From the collection आमाको सपना. Transcribed from the identified Sahitya Ras source edition. Source wording and literary structure retained; not checked against printed pages.",
  "rights": {
    "status": "public-domain",
    "basis": "Author died 1973; Nepal's Copyright Act 2059 grants life + 50 years."
  },
  "source": {
    "name": "Sahitya Ras (sahityaras.com)",
    "url": "https://sahityaras.com/book/aamako-sapana/gita/",
    "pdf": "sahityaras-aamako-sapana.pdf",
    "html": "extracted/index.html",
    "pdf_editions": [
      {
        "id": "sahityaras-aamako-sapana",
        "file": "sahityaras-aamako-sapana.pdf",
        "kind": "typeset",
        "label": "साहित्यरस · आमाको सपना",
        "sha256": "bf3e3e705360c706b3d46e59289926beea65c01eab5dc43eb419b09f3bc1eeda",
        "page_count": 1,
        "origin": {
          "name": "Sahitya Ras",
          "url": "https://sahityaras.com/download.php?book=aamako-sapana&format=pdf"
        },
        "sections": [
          {
            "label": "गीत",
            "page_start": 1,
            "page_end": 1
          }
        ]
      }
    ]
  },
  "pages": 1,
  "text": {
    "extraction_method": "html",
    "ocr_status": "born-digital",
    "proofread": false,
    "quality": null
  },
  "formats": {
    "pdf": "sahityaras-aamako-sapana.pdf",
    "txt": "text.txt",
    "html": "reader.html",
    "epub": "reader.epub"
  },
  "added": "2026-09-08",
  "updated": "2026-09-09",
  "summary": "दुर्गालाई अँध्यारो हटाई उज्यालो फैलाउन, भित्री मनको पुकार सुन्न र नेपालीहरूमा साझा भाव जगाउन आह्वान गरिएको छ।",
  "prosody": {
    "status": "uncertain",
    "kind": "unresolved",
    "metres": [],
    "text_sha256": "7d7fb0b451fb733db6d05b9c22d53a998bd8987e42b84aefa2e37bbe6fa2d9eb",
    "reviewed": "2026-10-31",
    "evidence": [
      {
        "basis": "editorial-reading",
        "file": "extracted/index.html",
        "sha256": "cf65b4fc29ba795ea9deacdc371d007b60f6390c0cc857e5cc01ac19b5c22c96",
        "locator": "गीत · सुरक्षित HTML पाठ",
        "note": "दुर्गालाई सम्बोधन, सुनिदेऊ/जगाइदेऊ तुकान्त र लामा–छोटा अन्तराका गेय समूह छन्। गीतको लयलाई निश्चित वर्णिक वा मुक्तछन्द ट्याग दिन पर्याप्त प्रमाण छैन।"
      }
    ],
    "review_note": "दुर्गालाई सम्बोधन, सुनिदेऊ/जगाइदेऊ तुकान्त र लामा–छोटा अन्तराका गेय समूह छन्। गीतको लयलाई निश्चित वर्णिक वा मुक्तछन्द ट्याग दिन पर्याप्त प्रमाण छैन।"
  }
}
