{
  "id": "ajako_samasya",
  "title": "आजको समस्या",
  "title_roman": "Ajako Samasya",
  "subtitle": null,
  "author": {
    "id": "bhimnidhi_tiwari",
    "name": "भीमनिधि तिवारी",
    "name_roman": "Bhimnidhi Tiwari"
  },
  "language": "ne",
  "script": "Devanagari",
  "genre": [
    "kavita"
  ],
  "first_published": {
    "bs": null,
    "ad": null
  },
  "edition": "पहिलो; २०७८",
  "publisher": "फिनिक्स बुक्स",
  "description": "From the collection विस्फोट. Transcribed from the identified Sahitya Ras source edition. Source wording and literary structure retained; not checked against printed pages.",
  "rights": {
    "status": "public-domain",
    "basis": "Author died 1973; Nepal's Copyright Act 2059 grants life + 50 years."
  },
  "source": {
    "name": "Sahitya Ras (sahityaras.com)",
    "url": "https://sahityaras.com/book/bisfot/ajako-samasya/",
    "pdf": "sahityaras-bisfot.pdf",
    "html": "extracted/index.html",
    "pdf_editions": [
      {
        "id": "sahityaras-bisfot",
        "file": "sahityaras-bisfot.pdf",
        "kind": "typeset",
        "label": "साहित्यरस · विस्फोट",
        "sha256": "f8d7b31701b2eb864723a6fa91fb53a6f1d5836a9d849a0099a4d8bbd0e99598",
        "page_count": 2,
        "origin": {
          "name": "Sahitya Ras",
          "url": "https://sahityaras.com/download.php?book=bisfot&format=pdf"
        },
        "sections": [
          {
            "label": "आजको समस्या",
            "page_start": 1,
            "page_end": 2
          }
        ]
      }
    ]
  },
  "pages": 2,
  "text": {
    "extraction_method": "html",
    "ocr_status": "born-digital",
    "proofread": false,
    "quality": null
  },
  "formats": {
    "pdf": "sahityaras-bisfot.pdf",
    "txt": "text.txt",
    "html": "reader.html",
    "epub": "reader.epub"
  },
  "added": "2026-09-08",
  "updated": "2026-09-09",
  "summary": "लहलह धान र भातजस्तो हिमालको बीच तीन दिनदेखि भोका दुई गरिबले ढुटो–चोकर खाएर बाँच्नुपरेको नेपालको विडम्बना।",
  "prosody": {
    "status": "reviewed",
    "kind": "free-verse",
    "metres": [],
    "text_sha256": "20cead6d456f302fae86cedfe0c340d92251ee7b1abb6e528005f5eb3d0e1594",
    "reviewed": "2026-10-31",
    "evidence": [
      {
        "basis": "editorial-reading",
        "file": "extracted/index.html",
        "sha256": "ba02f742c6fb62f4317731e2afe76469724d9f7bb2cc255cebd7a8c3a0700d22",
        "locator": "आजको समस्या · सुरक्षित HTML पाठ",
        "note": "धान पाकेको दृश्य र भोका मानिसको उद्धृत संवादका तीन असमान खण्डमा वाक्यगत स्वतन्त्र लय छ। अन्त्यका लामा–छोटा आह्वान र शाब्दिक पुनरावृत्ति निश्चित पाउमा बन्द छैनन्।"
      }
    ]
  }
}
