{
  "id": "parashuramako_dronacharyasag_ukti",
  "title": "परशुरामको द्रोणाचार्यसँग उक्ति",
  "title_roman": "Parashuramako Dronacharyasag Ukti",
  "subtitle": null,
  "author": {
    "id": "lekhnath_paudyal",
    "name": "लेखनाथ पौड्याल",
    "name_roman": "Lekhnath Paudyal"
  },
  "language": "ne",
  "script": "Devanagari",
  "genre": [
    "kavita"
  ],
  "first_published": {
    "bs": null,
    "ad": null
  },
  "edition": "पहिलो; २०७६",
  "publisher": "मञ्जरी पब्लिकेशन",
  "description": "From the collection लालित्य भाग २. Transcribed from the identified Sahitya Ras source edition. Source wording and literary structure retained; not checked against printed pages.",
  "rights": {
    "status": "public-domain",
    "basis": "Author died 1966; public domain since 2016 (Nepal's Copyright Act 2059: life + 50 years)."
  },
  "source": {
    "name": "Sahitya Ras (sahityaras.com)",
    "url": "https://sahityaras.com/book/lalitya-bhag-2/parashuramko-dronacharyasanga-ukti/",
    "pdf": "sahityaras-lalitya-bhag-2.pdf",
    "html": "extracted/index.html",
    "pdf_editions": [
      {
        "id": "sahityaras-lalitya-bhag-2",
        "file": "sahityaras-lalitya-bhag-2.pdf",
        "kind": "typeset",
        "label": "साहित्यरस · लालित्य भाग २",
        "sha256": "280232eb1bfb6cab3349378db089b34b3117a9ff8be66aad1887dcbf4fa4bbcb",
        "page_count": 2,
        "origin": {
          "name": "Sahitya Ras",
          "url": "https://sahityaras.com/download.php?book=lalitya-bhag-2&format=pdf"
        },
        "sections": [
          {
            "label": "परशुरामको द्रोणाचार्यसँग उक्ति",
            "page_start": 1,
            "page_end": 2
          }
        ]
      }
    ]
  },
  "pages": 2,
  "text": {
    "extraction_method": "html",
    "ocr_status": "born-digital",
    "proofread": false,
    "quality": null
  },
  "formats": {
    "pdf": "sahityaras-lalitya-bhag-2.pdf",
    "txt": "text.txt",
    "html": "reader.html",
    "epub": "reader.epub"
  },
  "added": "2026-09-08",
  "updated": "2026-09-09",
  "summary": "परशुराम र द्रोणाचार्यको संवादमा शस्त्र, गुरुता, अधिकार र धर्मबारे उठेको कठोर तर्क प्रस्तुत हुन्छ।",
  "prosody": {
    "status": "reviewed",
    "kind": "single",
    "metres": [
      "vasanta"
    ],
    "text_sha256": "87f080c5fd95f947436f8de73a097c600e8ebfde7269d1efcf6842f7f3815dd1",
    "reviewed": "2026-10-30",
    "evidence": [
      {
        "basis": "metrical-reading",
        "file": "extracted/index.html",
        "sha256": "eb4bf87a0e002960c8446a61cf283031f92c45e2b99341715978cd4ccc31cb3b",
        "locator": "पूर्ण कविता",
        "note": "गद्यात्मक प्रसङ्ग-परिचयपछि पाँच श्लोकको वसन्ततिलका लय पढिएको। “कश्यपाऽऽदि”, “पाइनँ” र “मानदैन” भएका पाउमा शाब्दिक अपवाद छन्; परिचय र शीर्षकलाई काव्यपाउ मानिएको छैन। पहिचान समग्र आवर्ती वृत्तको हो; यसले प्रत्येक पाउ निर्दोष छ वा पाठको प्रूफरीडिङ सकिएको छ भन्ने प्रमाणित गर्दैन।"
      }
    ]
  }
}
