{
  "id": "pralayabedana",
  "title": "प्रलयवेदना",
  "title_roman": "Pralayabedana",
  "subtitle": null,
  "author": {
    "id": "devkota",
    "name": "लक्ष्मीप्रसाद देवकोटा",
    "name_roman": "Laxmi Prasad Devkota"
  },
  "language": "ne",
  "script": "Devanagari",
  "genre": [
    "kavita",
    "poem"
  ],
  "first_published": {
    "bs": null,
    "ad": null
  },
  "edition": null,
  "publisher": null,
  "description": "From the collection लक्ष्मी कवितासङ्ग्रह.",
  "rights": {
    "status": "public-domain",
    "basis": "Author died 1959; Nepal's Copyright Act 2059 grants life + 50 years, expiring 2009."
  },
  "source": {
    "name": "Kavita Kosh (kavitakosh.org)",
    "url": "https://kavitakosh.org/kk/प्रलयवेदना_/_लक्ष्मीप्रसाद_देवकोटा",
    "pdf": null,
    "html": "extracted/index.html"
  },
  "pages": null,
  "text": {
    "extraction_method": "html",
    "ocr_status": "born-digital",
    "proofread": false,
    "quality": "good"
  },
  "formats": {
    "pdf": null,
    "txt": "text.txt",
    "html": "reader.html",
    "epub": "reader.epub"
  },
  "added": "2026-06-05",
  "updated": "2026-09-09",
  "summary": "प्रलयको उग्र हुरी र सुखदुःखको गहिरो द्वन्द्वमा डुबेको मनले संसारको पीडा, विनाश र अनियन्त्रित वेदना व्यक्त गर्छ।",
  "prosody": {
    "status": "uncertain",
    "kind": "unresolved",
    "metres": [],
    "text_sha256": "4416e0ddc9e01aa32f6d918d6e00c092919ad5a56588a74a5473ec2de6f8bdad",
    "reviewed": "2026-10-31",
    "evidence": [
      {
        "basis": "editorial-reading",
        "file": "extracted/index.html",
        "sha256": "5e354be4ca7e532a4adeb1a063484e8036f43c52f7c34d059f631a3e23bd1a46",
        "locator": "प्रलयवेदना · सुरक्षित HTML पाठ",
        "note": "सुरुको हुरी-वर्णनपछि सोह्र लामो तुकान्त युग्ममा प्रार्थना छ; दुई खण्डको विस्तारित गेय चालको निश्चित छन्दनाम अनिर्णीत।"
      }
    ],
    "review_note": "सुरुको हुरी-वर्णनपछि सोह्र लामो तुकान्त युग्ममा प्रार्थना छ; दुई खण्डको विस्तारित गेय चालको निश्चित छन्दनाम अनिर्णीत।"
  }
}
