{
  "id": "kabiko_unnidrata",
  "title": "कविको उन्निद्रता",
  "title_roman": "Kabiko Unnidrata",
  "subtitle": null,
  "author": {
    "id": "lekhnath_paudyal",
    "name": "लेखनाथ पौड्याल",
    "name_roman": "Lekhnath Paudyal"
  },
  "language": "ne",
  "script": "Devanagari",
  "genre": [
    "kavita"
  ],
  "first_published": {
    "bs": null,
    "ad": null
  },
  "edition": "पहिलो; २०७६",
  "publisher": "मञ्जरी पब्लिकेशन",
  "description": "From the collection लालित्य भाग २. Transcribed from the identified Sahitya Ras source edition. Source wording and literary structure retained; not checked against printed pages.",
  "rights": {
    "status": "public-domain",
    "basis": "Author died 1966; public domain since 2016 (Nepal's Copyright Act 2059: life + 50 years)."
  },
  "source": {
    "name": "Sahitya Ras (sahityaras.com)",
    "url": "https://sahityaras.com/book/lalitya-bhag-2/kaviko-unnidrata/",
    "pdf": "sahityaras-lalitya-bhag-2.pdf",
    "html": "extracted/index.html",
    "pdf_editions": [
      {
        "id": "sahityaras-lalitya-bhag-2",
        "file": "sahityaras-lalitya-bhag-2.pdf",
        "kind": "typeset",
        "label": "साहित्यरस · लालित्य भाग २",
        "sha256": "ee4863134f7c43b2b932b0d93c41de213b557b32cf6d13a62e83631803ba8632",
        "page_count": 9,
        "origin": {
          "name": "Sahitya Ras",
          "url": "https://sahityaras.com/download.php?book=lalitya-bhag-2&format=pdf"
        },
        "sections": [
          {
            "label": "कविको उन्निद्रता",
            "page_start": 1,
            "page_end": 9
          }
        ]
      }
    ]
  },
  "pages": 9,
  "text": {
    "extraction_method": "html",
    "ocr_status": "born-digital",
    "proofread": false,
    "quality": null
  },
  "formats": {
    "pdf": "sahityaras-lalitya-bhag-2.pdf",
    "txt": "text.txt",
    "html": "reader.html",
    "epub": "reader.epub"
  },
  "added": "2026-09-08",
  "updated": "2026-09-09",
  "summary": "प्रकृति निदाएको रातमा जागा कविले भूत, भोको कङ्काल र सामाजिक मोहका दृश्य देखेर निद्राले संसारको शान्ति डुबाएको भन्दै लेखनी चलाउन उन्निद्रताको कामना गर्छ।",
  "prosody": {
    "status": "reviewed",
    "kind": "single",
    "metres": [
      "mandakranta"
    ],
    "text_sha256": "c6813bdebbfbf8e5d43fda856b9198affc78e8fcf97e38aeff12a1bad96694cd",
    "reviewed": "2026-10-31",
    "evidence": [
      {
        "basis": "metrical-reading",
        "file": "extracted/index.html",
        "sha256": "f8c0c0f0b425e2506fc907caa47b7dd2ee6721f8da2c90778475e483011a3315",
        "locator": "कविको उन्निद्रता · सुरक्षित HTML पाठ",
        "note": "चौँतीस चौपदीमा १७ अक्षरे मन्दाक्रान्ता र ४+६+७ विरामको धारा स्पष्ट छ; १३६ मध्ये सय चरणको अक्षरशः क्रम मिल्छ, अन्यमा स्रोतको बोली/वर्तनी र अन्त्यको छुट छन्।"
      }
    ]
  }
}
