{
  "id": "basanta",
  "title": "वसन्त",
  "title_roman": "Basanta",
  "subtitle": null,
  "author": {
    "id": "devkota",
    "name": "लक्ष्मीप्रसाद देवकोटा",
    "name_roman": "Laxmi Prasad Devkota"
  },
  "language": "ne",
  "script": "Devanagari",
  "genre": [
    "kavita",
    "poem"
  ],
  "first_published": {
    "bs": null,
    "ad": null
  },
  "edition": null,
  "publisher": null,
  "description": "From the collection भिखारी (कवितासङ्ग्रह); लक्ष्मी कवितासङ्ग्रह.",
  "rights": {
    "status": "public-domain",
    "basis": "Author died 1959; Nepal's Copyright Act 2059 grants life + 50 years, expiring 2009."
  },
  "source": {
    "name": "Kavita Kosh (kavitakosh.org)",
    "url": "https://kavitakosh.org/kk/वसन्त_/_लक्ष्मीप्रसाद_देवकोटा",
    "pdf": null,
    "html": "extracted/index.html"
  },
  "pages": null,
  "text": {
    "extraction_method": "html",
    "ocr_status": "born-digital",
    "proofread": false,
    "quality": "good"
  },
  "formats": {
    "pdf": null,
    "txt": "text.txt",
    "html": "reader.html",
    "epub": "reader.epub"
  },
  "added": "2026-06-05",
  "updated": "2026-09-09",
  "summary": "मौरी, चरा, फूल, सुगन्ध र हिमालको लालीसँग आएको वसन्तले धरतीलाई स्वर्गजस्तो बनाएर मन र इन्द्रियमा चञ्चलता भरेको छ।",
  "prosody": {
    "status": "uncertain",
    "kind": "unresolved",
    "metres": [],
    "text_sha256": "4b4a563c7ab07db4e5640a31dcb3d0aa894be7756ecc67c747cef9841ea53276",
    "reviewed": "2026-10-31",
    "evidence": [
      {
        "basis": "editorial-reading",
        "file": "extracted/index.html",
        "sha256": "46a4722210cd18a3f0d65bde54a998921974a517e8b8b5cbafcf9f3258050fe1",
        "locator": "वसन्त · सुरक्षित HTML पाठ",
        "note": "आठ समूहमा लामो चित्रण र छोटा तुकान्त उद्गारको पालो छ; सम/विषम मात्रिक योजना स्पष्ट नभएकाले निश्चित छन्द ट्याग रोकिएको छ।"
      }
    ],
    "review_note": "आठ समूहमा लामो चित्रण र छोटा तुकान्त उद्गारको पालो छ; सम/विषम मात्रिक योजना स्पष्ट नभएकाले निश्चित छन्द ट्याग रोकिएको छ।"
  }
}
