{
  "id": "hamro_indreni",
  "title": "हाम्रो इन्द्रेनी",
  "title_roman": "Hamro Indreni",
  "subtitle": null,
  "author": {
    "id": "lekhnath_paudyal",
    "name": "लेखनाथ पौड्याल",
    "name_roman": "Lekhnath Paudyal"
  },
  "language": "ne",
  "script": "Devanagari",
  "genre": [
    "kavita",
    "poem"
  ],
  "first_published": {
    "bs": 2013,
    "ad": null
  },
  "edition": null,
  "publisher": null,
  "description": "Lekhnath Paudyal's poem \"हाम्रो इन्द्रेनी\" contemplates a rainbow seen across a mountain valley, imagining it through a sequence of fanciful comparisons before it fades.",
  "rights": {
    "status": "public-domain",
    "basis": "Author died 1966; public domain since 2016 (Nepal's Copyright Act 2059: life + 50 years)."
  },
  "source": {
    "name": "लेखनाथका प्रमुख कविता (साझा प्रकाशन)",
    "url": null,
    "pdf": "hamro_indreni.pdf",
    "html": null
  },
  "pages": 2,
  "text": {
    "extraction_method": "ocr",
    "ocr_status": "ocr-done",
    "proofread": false,
    "quality": "good"
  },
  "formats": {
    "pdf": "hamro_indreni.pdf",
    "txt": "text.txt",
    "html": "reader.html",
    "epub": "reader.epub"
  },
  "added": "2026-06-07",
  "updated": "2026-09-09",
  "summary": "पर्वत र खोलामाथि उभिएको सातरङ्गी इन्द्रेनी कसले बनायो भनी अनेक कल्पना गर्दै अन्त्यमा हृदयमा उठ्ने आशाको क्षणिक रङ्गीन उज्यालोसँग जोडिएको छ।",
  "prosody": {
    "status": "uncertain",
    "kind": "unresolved",
    "metres": [],
    "text_sha256": "f1fff0074148b440a630b5b984ae2dcc19886e1f7f7678aba551e0f30c8cad1c",
    "reviewed": "2026-10-31",
    "evidence": [
      {
        "basis": "editorial-reading",
        "file": "hamro_indreni.pdf",
        "sha256": "327f4691e4860f134aff5473b6c296ba9592e8774c25f9745cbcf94033a5078c",
        "locator": "हाम्रो इन्द्रेनी · सुरक्षित PDF मा यस शीर्षकको काव्यपाठ",
        "note": "हाम्रो इन्द्रेनीका छ चौपदीमा सृष्टि, विरह र राष्ट्रभावनाका लामा तुकान्त पङ्क्ति छन्। मुद्रित पृष्ठ ३२–३३ मा पढिएको; तीस–बत्तीस मात्रा आसपासको लयको निश्चित नाम बाँकी छ।"
      }
    ],
    "review_note": "हाम्रो इन्द्रेनीका छ चौपदीमा सृष्टि, विरह र राष्ट्रभावनाका लामा तुकान्त पङ्क्ति छन्। मुद्रित पृष्ठ ३२–३३ मा पढिएको; तीस–बत्तीस मात्रा आसपासको लयको निश्चित नाम बाँकी छ।"
  }
}
